StartDate,EndDate,Status,IPAddress,Progress,Duration (in seconds),Finished,RecordedDate,ResponseId,RecipientLastName,RecipientFirstName,RecipientEmail,ExternalReference,LocationLatitude,LocationLongitude,DistributionChannel,UserLanguage,QW3,Q0.1,Q0.1_99_TEXT,Q0.2,Q0.3,Q1.1_1,Q1.1_2,Q1.1_3,Q1.2_1,Q1.2_2,Q1.2_3,Q1.3,Q2.1_1,Q2.1_2,Q2.1_3,Q2.2_1,Q2.2_2,Q2.2_3,Q2.3,Q3.1_1,Q3.1_2,Q3.2_1,Q3.2_2,Q3.3,Q4.1_1,Q4.1_2,Q4.2_1,Q4.2_2,Q4.3,Q5.1_1,Q5.1_2,Q5.1_3,Q5.2_1,Q5.2_2,Q5.2_3,Q5.3,Q6.1_1,Q6.1_2,Q6.1_3,Q6.2_1,Q6.2_2,Q6.2_3,Q6.3,Q7.1_1,Q7.1_2,Q7.2_1,Q7.2_2,Q7.3,Q8.1_1,Q8.1_2,Q8.1_3,Q8.2_1,Q8.2_2,Q8.2_3,Q8.3
Start Date,End Date,Response Type,IP Address,Progress,Duration (in seconds),Finished,Recorded Date,Response ID,Recipient Last Name,Recipient First Name,Recipient Email,External Data Reference,Location Latitude,Location Longitude,Distribution Channel,User Language,Pie Chart Text (hidden),Which is your function or department? - Selected Choice,Which is your function or department? - Other (please specify): - Text,Which best describes your role?,How long have you been with [Field-vchClientCoName]?,How would you rate the following aspects at the Moderna workplace? - Spaces to be Active,How would you rate the following aspects at the Moderna workplace? - Healthy Menus,How would you rate the following aspects at the Moderna workplace? - Spaces to Decompress,How important are these aspects to you? - Spaces to be Active,How important are these aspects to you? - Healthy Menus,How important are these aspects to you? - Spaces to Decompress,What other things matter in fostering physical wellbeing for all of us at Moderna?,How would you rate the following aspects at the Moderna workplace? - Natural Lighting and Views,How would you rate the following aspects at the Moderna workplace? - Noise and Acoustics,How would you rate the following aspects at the Moderna workplace? - Temperature,How important are these aspects to you? - Natural Lighting and Views,How important are these aspects to you? - Noise and Acoustics,How important are these aspects to you? - Temperature,What other things matter in fostering wellness associated to the physical environment for all of us at Moderna?,How would you rate the following aspects at Moderna? - Sense of meaning in the tasks you do,How would you rate the following aspects at Moderna? - Sense of Impact of the work Moderna does,How important are these aspects to you? - Sense of meaning in the tasks you do,How important are these aspects to you? - Sense of Impact of the work Moderna does,What other things matter in fostering a sense of purpose for all of us at Moderna?,How would you rate the following aspects at Moderna? - Your sense of pride in being part of Moderna,How would you rate the following aspects at Moderna? - Your sense that your culture and values are celebrated at Moderna,How important are these aspects to you? - Your sense of pride in being part of Moderna,How important are these aspects to you? - Your sense that your culture and values are celebrated at Moderna,What other things matter in fostering a people centered organizational culture for all of us at Moderna?,How would you rate the following aspects at Moderna? - Work-Life Balance,How would you rate the following aspects at Moderna? - Sense of future professional growth,How would you rate the following aspects at Moderna? - Mentorship,How important are these aspects to you? - Work-Life Balance,How important are these aspects to you? - Sense of future professional growth,How important are these aspects to you? - Mentorship,What other things matter in fostering professional wellbeing for all of us at Moderna?,How would you rate the following aspects at Moderna? - Inspires new thinking,How would you rate the following aspects at Moderna? - Openness to Experimentation,How would you rate the following aspects at Moderna? - Sense that it’s ok to make mistakes and grow,How important are these aspects to you? - Inspires new thinking,How important are these aspects to you? - Openness to Experimentation,How important are these aspects to you? - Sense that it’s ok to make mistakes and grow,What other things matter in fostering intellectual wellbeing for all of us at Moderna?,How would you rate the following aspects at Moderna? - Relationship with Colleagues,How would you rate the following aspects at Moderna? - Relationship with Leadership,How important are these aspects to you? - Relationship with Colleagues,How important are these aspects to you? - Relationship with Leadership,What other things matter in fostering social wellbeing for all of us at Moderna?,How would you rate the following aspects at Moderna? - Sense that I can speak up,How would you rate the following aspects at Moderna? - Sense of belonging within the Moderna community,How would you rate the following aspects at Moderna? - Sense that someone at Moderna cares about me,How important are these aspects to you? - Sense that I can speak up,How important are these aspects to you? - Sense of belonging within the Moderna community,How important are these aspects to you? - Sense that someone at Moderna cares about me,What other things matter in fostering emotional wellbeing for all of us at Moderna?
"{""ImportId"":""startDate"",""timeZone"":""America/Denver""}","{""ImportId"":""endDate"",""timeZone"":""America/Denver""}","{""ImportId"":""status""}","{""ImportId"":""ipAddress""}","{""ImportId"":""progress""}","{""ImportId"":""duration""}","{""ImportId"":""finished""}","{""ImportId"":""recordedDate"",""timeZone"":""America/Denver""}","{""ImportId"":""_recordId""}","{""ImportId"":""recipientLastName""}","{""ImportId"":""recipientFirstName""}","{""ImportId"":""recipientEmail""}","{""ImportId"":""externalDataReference""}","{""ImportId"":""locationLatitude""}","{""ImportId"":""locationLongitude""}","{""ImportId"":""distributionChannel""}","{""ImportId"":""userLanguage""}","{""ImportId"":""QID204""}","{""ImportId"":""QID421""}","{""ImportId"":""QID421_99_TEXT""}","{""ImportId"":""QID422""}","{""ImportId"":""QID423""}","{""ImportId"":""QID389_1""}","{""ImportId"":""QID389_2""}","{""ImportId"":""QID389_3""}","{""ImportId"":""QID390_1""}","{""ImportId"":""QID390_2""}","{""ImportId"":""QID390_3""}","{""ImportId"":""QID412_TEXT""}","{""ImportId"":""QID392_1""}","{""ImportId"":""QID392_2""}","{""ImportId"":""QID392_3""}","{""ImportId"":""QID393_1""}","{""ImportId"":""QID393_2""}","{""ImportId"":""QID393_3""}","{""ImportId"":""QID413_TEXT""}","{""ImportId"":""QID395_1""}","{""ImportId"":""QID395_2""}","{""ImportId"":""QID396_1""}","{""ImportId"":""QID396_2""}","{""ImportId"":""QID414_TEXT""}","{""ImportId"":""QID398_1""}","{""ImportId"":""QID398_2""}","{""ImportId"":""QID399_1""}","{""ImportId"":""QID399_2""}","{""ImportId"":""QID415_TEXT""}","{""ImportId"":""QID401_1""}","{""ImportId"":""QID401_2""}","{""ImportId"":""QID401_3""}","{""ImportId"":""QID402_1""}","{""ImportId"":""QID402_2""}","{""ImportId"":""QID402_3""}","{""ImportId"":""QID416_TEXT""}","{""ImportId"":""QID404_1""}","{""ImportId"":""QID404_2""}","{""ImportId"":""QID404_3""}","{""ImportId"":""QID405_1""}","{""ImportId"":""QID405_2""}","{""ImportId"":""QID405_3""}","{""ImportId"":""QID417_TEXT""}","{""ImportId"":""QID407_1""}","{""ImportId"":""QID407_2""}","{""ImportId"":""QID408_1""}","{""ImportId"":""QID408_2""}","{""ImportId"":""QID418_TEXT""}","{""ImportId"":""QID410_1""}","{""ImportId"":""QID410_2""}","{""ImportId"":""QID410_4""}","{""ImportId"":""QID411_1""}","{""ImportId"":""QID411_2""}","{""ImportId"":""QID411_4""}","{""ImportId"":""QID419_TEXT""}"
2021-03-29 13:33:15,2021-03-29 13:42:38,IP Address,50.226.100.30,100,562,True,2021-03-29 13:42:40,R_2AMTLLWYVyAd7b8,,,,,42.336395263671875,-71.03260040283203125,anonymous,EN,,,,,,1,4,2,2,5,3,Enough space in cafe to have meals with teams.,4,3,4,4,4,4,,4,5,5,4,,5,4,5,5,,2,3,3,5,4,3,,4,3,4,4,4,5,,4,4,5,5,,4,4,4,5,5,4,
2021-03-29 18:42:12,2021-03-29 18:57:54,IP Address,50.226.100.30,100,941,True,2021-03-29 18:57:55,R_NUUixSqjomcerkt,,,,,42.336395263671875,-71.03260040283203125,anonymous,EN,,,,,,3,4,4,5,4,0,On campus walking trails.  On campus sporting fields and courts to promote teamwork with others outside of our departmnts.  Large gym in a centralized location.  Different food options in different locations.,4,3,4,5,4,4,Nice landscape around campus.  More updated buildings made of glass.  Tracking and displaying green type items.,5,5,5,5,"work/life balance.  Learning about future pipeline.  Patients.  ",5,4,5,4,Recognition for efforts.  Celebrating the wins.  Amenities and offerings to still feel like a startup company.,0,4,2,4,5,4,"Having clear set goals and working to achieve them (both short and long term).  Clear succession planning with time to shadow and prepare for the new position ahead.,",4,4,4,5,5,4,"Promoting and sharing these ideas, successes and failures with others in the company.  Spaces and meetings with a mixture of diverse backgrounds and departments",4,3,5,4,Recognition from all levels.  Celebrate the wins - big and small.,5,3,3,5,4,5,Taking time off without having to log into the computer / meetings.
2021-03-29 15:09:17,2021-03-30 07:10:36,IP Address,50.235.10.2,100,57679,True,2021-03-30 07:10:37,R_Ti5Ta4y1tPdJVMB,,,,,42.364898681640625,-71.09870147705078125,anonymous,EN,,,,,,3,3,2,4,4,5,Work hours and ability to also work flexibly/remotely,5,3,4,3,4,4,People's adherence to open plan etiquette and use of common spaces,5,5,5,5,,5,5,5,5,,1,4,1,4,3,3,,4,5,2,4,4,4,,5,3,5,3,,5,5,5,4,5,4,
2021-03-30 11:27:30,2021-03-30 11:32:19,IP Address,50.235.10.2,100,288,True,2021-03-30 11:32:20,R_3PfrJVmGJBhOwjT,,,,,42.364898681640625,-71.09870147705078125,anonymous,EN,,,,,,2,3,2,4,5,4,,4,2,3,4,4,4,,4,5,5,5,,5,4,5,5,,1,5,4,1,5,4,,5,5,4,5,5,4,,5,5,5,5,,4,5,5,4,5,5,
2021-03-30 09:32:29,2021-03-30 11:51:28,IP Address,50.226.100.30,100,8339,True,2021-03-30 11:51:29,R_242BXImYKDEnKAh,,,,,42.336395263671875,-71.03260040283203125,anonymous,EN,,,,,,3,3,3,4,5,3,,2,0,2,3,5,4,,5,5,5,5,,5,5,4,4,,0,4,3,3,4,3,,3,4,4,5,5,4,,4,4,4,4,,4,4,4,5,5,4,
2021-03-30 12:26:34,2021-03-30 15:19:36,IP Address,50.235.10.2,100,10382,True,2021-03-30 15:19:37,R_3CUA1KKB2iMVoQ9,,,,,42.364898681640625,-71.09870147705078125,anonymous,EN,,,,,,1,3,0,4,4,4,"spaces where people can do their *best* work - knowing that sometimes that work is collaborative and sometimes quiet space for deep work is needed. and those spaces need to be ergonomic, attractive and pleasant to be in, of course. having a layout that encourages physical movement is also great - meaning that not every office will have every amenity within 20 feet - having to take the stairs to get to a conference room is not a bad thing.",3,3,4,5,5,3,"Managing noise is huge. Strategically running HVAC to provide white noise in an open office setting actually enables conversation and reduces distraction in the work spaces. ",2,4,4,5,"i am bought in to the overall purpose of Moderna, 100%. my day-to-day is very bogged down with garbage admin work related to our lack of coherent systems and antiquated digital integration. it makes my daily work much harder AND less effective relative to the effort i'm expending, so my connection to the larger purpose starts to feel more distant. systems that work MATTER for fostering a sense of purpose.",4,3,4,4,"we talk a big game about our culture - and i believe that leaders really mean what they say. but the pace at which we are running means that we can't actually do the right things to support the culture we say we want. and the longer there is a gap between what leaders say and what we actually do - the credibility risk only grows. like seriously stop about AI and Digital - our systems are what any old-school fortune 500 company had 15 years ago. we aren't doing ANYTHING cool in 90% of the org - in fact, most of us struggle because the systems (or the 'experts' behind) are sub-par.",2,3,1,4,3,3,access to leaders who walk the talk. access to information about how decisions get made and what success looks like.,3,3,3,4,4,4,"ability to network with like-minded colleagues. now, unless you know someone, networking spontaneously is nearly impossible.",3,3,4,3,,3,3,4,4,4,4,"acknowledgement that it's okay not to be perfect/""on"" 100% of the time. again, lots of talking the talk, not so much walking the walk."
